{"schemaVersion":1,"namespace":"appleproof","sourceLocale":"en","messages":{"welcome":{"arguments":{"name":"string"},"body":{"text":"Welcome, {name}"}},"items.count":{"arguments":{"count":"int"},"body":{"plural":"count","cases":{"one":"{count} item","other":"{count} items"}}},"reordered":{"arguments":{"name":"string","quantity":"int"},"body":{"plural":"quantity","cases":{"one":"{name}: {quantity} item ({name})","other":"{name}: {quantity} items ({name})"}}},"literal":{"arguments":{},"body":{"text":"100% {{braces}} \\ \"quote\"\n$({{name}})"}}}}
